{
  "$schema": "http://json-schema.org/draft-07/schema#",
  "type": "object",
  "properties": {
    "uid": {
      "type": "integer",
      "minimum": 0,
      "maximum": 9007199254740991
    },
    "key": {
      "type": "array",
      "items": {
        "type": "string"
      }
    },
    "keysecondary": {
      "type": "array",
      "items": {
        "type": "string"
      }
    },
    "selective": {
      "type": "boolean"
    },
    "selectiveLogic": {
      "anyOf": [
        {
          "type": "number",
          "const": 0
        },
        {
          "type": "number",
          "const": 1
        },
        {
          "type": "number",
          "const": 2
        },
        {
          "type": "number",
          "const": 3
        }
      ]
    },
    "constant": {
      "type": "boolean"
    },
    "content": {
      "type": "string"
    },
    "comment": {
      "type": "string"
    },
    "position": {
      "anyOf": [
        {
          "type": "number",
          "const": 0
        },
        {
          "type": "number",
          "const": 1
        },
        {
          "type": "number",
          "const": 2
        },
        {
          "type": "number",
          "const": 3
        },
        {
          "type": "number",
          "const": 4
        },
        {
          "type": "number",
          "const": 5
        },
        {
          "type": "number",
          "const": 6
        },
        {
          "type": "number",
          "const": 7
        }
      ]
    },
    "order": {
      "type": "integer",
      "minimum": -9007199254740991,
      "maximum": 9007199254740991
    },
    "depth": {
      "type": "integer",
      "minimum": 0,
      "maximum": 9007199254740991
    },
    "role": {
      "anyOf": [
        {
          "type": "number",
          "const": 0
        },
        {
          "type": "number",
          "const": 1
        },
        {
          "type": "number",
          "const": 2
        }
      ]
    },
    "disable": {
      "type": "boolean"
    },
    "scanDepth": {
      "anyOf": [
        {
          "type": "integer",
          "minimum": 0,
          "maximum": 9007199254740991
        },
        {
          "type": "null"
        }
      ]
    },
    "caseSensitive": {
      "type": [
        "boolean",
        "null"
      ]
    },
    "matchWholeWords": {
      "type": [
        "boolean",
        "null"
      ]
    },
    "excludeRecursion": {
      "type": "boolean"
    },
    "preventRecursion": {
      "type": "boolean"
    },
    "delayUntilRecursion": {
      "anyOf": [
        {
          "type": "integer",
          "minimum": 0,
          "maximum": 9007199254740991
        },
        {
          "type": "null"
        }
      ]
    },
    "outletName": {
      "type": "string"
    },
    "extra": {
      "type": "object",
      "propertyNames": {
        "type": "string"
      },
      "additionalProperties": {}
    }
  },
  "required": [
    "uid",
    "key",
    "keysecondary",
    "selective",
    "selectiveLogic",
    "constant",
    "content",
    "comment",
    "position",
    "order",
    "depth",
    "role",
    "disable",
    "scanDepth",
    "caseSensitive",
    "matchWholeWords"
  ],
  "additionalProperties": false,
  "$comment": "Generated from schema.ts by scripts/generate-native-card-schemas.ts."
}
