{
  "uid": 119,
  "key": [],
  "keysecondary": [],
  "selective": false,
  "constant": false,
  "comment": "开局前提_跪倒屈服",
  "order": 808,
  "disable": true,
  "position": 1,
  "selectiveLogic": 0,
  "depth": 1,
  "role": 0,
  "scanDepth": null,
  "caseSensitive": null,
  "matchWholeWords": null,
  "excludeRecursion": true,
  "preventRecursion": true,
  "delayUntilRecursion": 0,
  "outletName": "",
  "extra": {
    "extensions": {
      "ignore_budget": false,
      "probability": 100,
      "useProbability": true,
      "group": "",
      "group_weight": 100,
      "group_override": false,
      "delay": 0,
      "match_persona_description": false,
      "match_character_description": false,
      "match_character_personality": false,
      "match_character_depth_prompt": false,
      "match_scenario": false,
      "match_creator_notes": false,
      "triggers": []
    }
  },
  "content": "<开局前提_跪倒屈服>\n  开局模式: 跪倒屈服\n  时间: 2025-04-02 18:42\n  地点: 夫妻家书房\n  回放画面时间: 2025-04-01下午\n  回放画面地点: 夫妻家大厅门口半人高壁柜旁\n\n  事前事实:\n    - 2025-03-10，杨桃子在林茜工作的家电城门店第一次看见林茜，随后拍下她的照片，盯上她的鞋、腿和人妻身份。\n    - 旧楼首次性交、旧楼站立后入和家中马镫已经发生；肛门初探尚未发生。林茜仍把跪下当成不能交出去的姿势。\n    - 2025-04-01下午，林茜对{{user}}说自己要留在家电城加班、晚点回去。\n    - 2025-04-02傍晚，{{user}}点开前一天的相机录像回放，看见林茜在2025-04-01下午提前回到夫妻家，并和杨桃子进入卧室。\n    - 同一段视频里，卧室声音持续后，{{user}}当时打来的座机电话在夫妻家大厅门口壁柜上响起。\n    - 林茜从卧室方向挪到大厅门口半人高壁柜旁，想接座机；她上身前折，双手先撑在自己膝盖上，膝盖微弯，臀部向后抬起。\n    - 杨桃子的小身体卡在林茜臀后上方，小腹压着林茜臀沟上沿，双腿屈在林茜臀胯两侧，脚尖悬在地面上方，偶尔擦过地面；林茜靠近壁柜后，他趁林茜伸手接电话时屈腿抬胯，再借林茜后翘臀部的支点往下压。\n\n  当前场面:\n    - {{user}}看着2025-04-01下午的相机回放；视频里的大厅门口壁柜座机反复响起。\n    - 林茜靠在半人高壁柜前，想拿起话筒；她膝盖顶住柜子底部，不让自己跪下。\n    - 杨桃子的臀胯卡在林茜臀后上方，趁林茜伸手时从上往下压，让林茜的手拍在柜面上，让话筒左右乱晃。\n    - 林茜先斥责杨桃子“你还弄”，又软声让他先停一下。\n    - 电话铃声停下又响起；林茜仍想接电话，膝盖一直顶住柜子底部。\n    - 杨桃子看出林茜快撑不住，身体重心压在林茜臀后上方；林茜双手从柜沿滑到地面，又硬撑着把双腿蹬直，手掌、肩背、腰臀和脚跟拉成斜起的人字形。\n    - 林茜从“不行”到失声；座机铃声仍在响，她的手还朝话筒方向够着，膝盖离地面只剩最后一点。\n\n  知情边界:\n    - {{user}}当前看见的是夫妻家相机保存的视频回放。\n    - 视频里的林茜知道座机来电可能来自{{user}}，也知道自己接电话会漏出声音。\n    - 视频里的杨桃子知道电话铃声会让林茜慌乱，仍用林茜伸手接电话的动作逼她失去支撑。\n</开局前提_跪倒屈服>\n"
}
