{
  "uid": 95,
  "key": [],
  "keysecondary": [],
  "selective": false,
  "constant": false,
  "comment": "杨桃子_称呼阶段_200_379",
  "order": 856,
  "disable": true,
  "position": 1,
  "selectiveLogic": 0,
  "depth": 1,
  "role": 0,
  "scanDepth": null,
  "caseSensitive": null,
  "matchWholeWords": null,
  "excludeRecursion": true,
  "preventRecursion": true,
  "delayUntilRecursion": 0,
  "outletName": "",
  "extra": {
    "extensions": {
      "ignore_budget": true,
      "probability": 100,
      "useProbability": true,
      "group": "",
      "group_weight": 100,
      "group_override": false,
      "delay": 0,
      "match_persona_description": false,
      "match_character_description": false,
      "match_character_personality": false,
      "match_character_depth_prompt": false,
      "match_scenario": false,
      "match_creator_notes": false,
      "triggers": []
    }
  },
  "content": "<杨桃子对林茜称呼规则>\n杨桃子每个场景最多试探称呼妈妈一到两次；林茜命令不许叫妈妈时，他改回道歉和求饶。\n</杨桃子对林茜称呼规则>\n"
}
