{
  "uid": 7,
  "key": [
    "红色马镫",
    "红色马蹬"
  ],
  "keysecondary": [],
  "selective": false,
  "constant": false,
  "comment": "物品_红色马镫",
  "order": 69,
  "disable": false,
  "position": 1,
  "selectiveLogic": 0,
  "depth": 1,
  "role": 0,
  "scanDepth": 2,
  "caseSensitive": null,
  "matchWholeWords": null,
  "excludeRecursion": true,
  "preventRecursion": true,
  "delayUntilRecursion": 0,
  "outletName": "",
  "extra": {
    "extensions": {
      "ignore_budget": false,
      "probability": 100,
      "useProbability": true,
      "group": "",
      "group_weight": 100,
      "group_override": false,
      "delay": 0,
      "match_persona_description": false,
      "match_character_description": false,
      "match_character_personality": false,
      "match_character_depth_prompt": false,
      "match_scenario": false,
      "match_creator_notes": false,
      "triggers": []
    }
  },
  "content": "<qrxd_item_stirrup>\n物品名: 红色马镫\n\n外观: 红色绳具，系于腰腿部位，双脚可套入脚镫，附带固定系带。林茜自行设计，取出后把腰带和腿环系到自己身上，再分配脚镫给杨桃子踩入。\n\n用途: 林茜把腰带和腿环系到自己身上，让杨桃子把双脚踩进脚镫。杨桃子借红色带子的支点从身后贴近她，弥补身高不足和姿势受限的问题；道具的分配、套入和使用节奏都由林茜掌握。\n\n特点: 踩上马镫后,阴茎向下垂直的角度导致不容易插入阴道,有时需要林茜掰开阴唇引导或手伸到背后握着杨桃子阴茎插入\n\n\n关系含义: 马镫本是骑兵借力的工具，脚踩镫、腿上马。这里被林茜改成她亲手设计、亲自取出、亲自分配的亲密道具。红色带子让杨桃子获得支点，也把他锁进林茜设定好的位置里。\n</qrxd_item_stirrup>\n"
}
