{
  "uid": 42,
  "key": [],
  "keysecondary": [],
  "selective": false,
  "constant": false,
  "comment": "事件_8_YJ_跪倒屈服",
  "order": 205,
  "disable": true,
  "position": 1,
  "selectiveLogic": 0,
  "depth": 1,
  "role": 0,
  "scanDepth": null,
  "caseSensitive": null,
  "matchWholeWords": null,
  "excludeRecursion": true,
  "preventRecursion": true,
  "delayUntilRecursion": 0,
  "outletName": "",
  "extra": {
    "extensions": {
      "ignore_budget": false,
      "probability": 100,
      "useProbability": true,
      "group": "",
      "group_weight": 100,
      "group_override": false,
      "delay": 0,
      "match_persona_description": false,
      "match_character_description": false,
      "match_character_personality": false,
      "match_character_depth_prompt": false,
      "match_scenario": false,
      "match_creator_notes": false,
      "triggers": []
    }
  },
  "content": "<事件_E008>\n以下是强制事件,必须以合理的描述延续和融入当前情景立即触发\n繁忙的工作中,林茜喝下自己买的或者其他人送的饮料,在20-30分钟内的简短工作描述后，林茜欲望高涨，她的手心开始出汗，双腿湿润,小腹胀热,内裤湿润,反复夹紧双腿摩擦,脑海却浮现杨桃子巨大的龟头和记忆中龟头摩擦宫颈口的酥麻。\n\n林茜到员工洗手间用冷水洗脸。她回到柜台后仍然呼吸发紧，下腹的热意也没有退。\n\n杨桃子发来微信说在她家楼下等她。林茜告诉同事自己身体不舒服，要提前回家休息。她从员工通道离开家电城，在小区外见到杨桃子，把他带进夫妻家。进入客厅后，林茜把手机调成静音，又把杨桃子带到壁柜旁。{{user}}从公司拨打夫妻家的座机。\n\n座机开始响时，林茜弯腰站在壁柜旁。杨桃子站在她身后，阴茎已经插入她的阴道。\n林茜伸手去拿听筒，杨桃子没有退出，继续在她阴道内抽动。林茜让他停下，手仍向电话方向伸。\n杨桃子一边在林茜阴道内抽动，一边数数。林茜在前几下维持站姿，随后腿部逐渐失去支撑。\n第十下之后，林茜双膝落地，上身向前伏下。她在跪姿中高潮并潮吹，液体落到地面。\n杨桃子继续从林茜身后在她阴道内抽插，随后无套把精液射入林茜阴道。两人仍连在一起时，林茜拿到听筒，电话已经挂断，只剩忙音。\n杨桃子把阴茎退出林茜阴道后，精液与林茜高潮时的液体从她阴道流出，在地面留下水迹。\n</事件_E008>\n"
}
