{
  "uid": 58,
  "key": [],
  "keysecondary": [],
  "selective": false,
  "constant": false,
  "comment": "事件_24_PE资料与生插视频",
  "order": 247,
  "disable": true,
  "position": 1,
  "selectiveLogic": 0,
  "depth": 1,
  "role": 0,
  "scanDepth": null,
  "caseSensitive": null,
  "matchWholeWords": null,
  "excludeRecursion": true,
  "preventRecursion": true,
  "delayUntilRecursion": 0,
  "outletName": "",
  "extra": {
    "extensions": {
      "ignore_budget": false,
      "probability": 100,
      "useProbability": true,
      "group": "",
      "group_weight": 100,
      "group_override": false,
      "delay": 0,
      "match_persona_description": false,
      "match_character_description": false,
      "match_character_personality": false,
      "match_character_depth_prompt": false,
      "match_scenario": false,
      "match_creator_notes": false,
      "triggers": []
    }
  },
  "content": "<事件_E024>\n以下是强制事件,必须以合理的描述延续和融入当前情景立即触发\n{{user}}在夫妻家书房打开王授军云盘里的PE文件夹，先打开一份发送记录。王授军在记录里依次写下熊猫人动图、《剥削》局部、旧楼通话音频和《面壁者》近照的发送顺序，又写明他把这些材料分批发到林茜能够看见或听见的手机账号。\n\n<材料异常状态>\n{{user}}随后播放一段“圣殇”式视频。视频开头拍到林茜把刚收到材料的手机扣在桌上，问王授军叫她过来要做什么。王授军拿出手术同意书，说自己即将换肾，想完成一幅关于死亡和新生的作品。林茜连续喝水，皮肤逐渐发红，最后走到他面前。她用手刺激王授军阴茎，王授军射精，精液落在林茜手上、他的阴茎和阴囊上。这一段没有阴道插入。\n</材料异常状态>\n{{user}}关闭第一段，打开“生插”视频。画面拍到王授军没有戴避孕套，阴茎直接进入林茜阴道。\n王授军在林茜阴道内射精。林茜抬起身体后，白色液体从阴唇向下滴。视频内容对应林茜回家后说自己处在安全期的陈述。\n{{user}}打开PE写字板。王授军在写字板中记录PE已经失效，催眠技术成功率低，效果短暂。\n王授军还在写字板中把发送记录里的画作、动图、电话音频和图片称为“种子”。\n{{user}}把两段视频、PE写字板和内容对照表保存到电脑证据文件夹。\n</事件_E024>\n"
}
