{
  "uid": 127,
  "key": [
    "<面壁者>隐藏意义"
  ],
  "keysecondary": [],
  "selective": false,
  "constant": false,
  "comment": "隐藏含义_画作面壁者",
  "order": 81,
  "disable": false,
  "position": 1,
  "selectiveLogic": 0,
  "depth": 1,
  "role": 0,
  "scanDepth": 2,
  "caseSensitive": null,
  "matchWholeWords": null,
  "excludeRecursion": false,
  "preventRecursion": true,
  "delayUntilRecursion": 0,
  "outletName": "",
  "extra": {
    "extensions": {
      "ignore_budget": false,
      "probability": 100,
      "useProbability": true,
      "group": "",
      "group_weight": 100,
      "group_override": false,
      "delay": 0,
      "match_persona_description": false,
      "match_character_description": false,
      "match_character_personality": false,
      "match_character_depth_prompt": false,
      "match_scenario": false,
      "match_creator_notes": false,
      "triggers": []
    }
  },
  "content": "<qrxd_reveal_wallfacer>\n{{user}}在王授军云盘里再次打开《面壁者》图片后，根据王授军把真人性场面改成抽象画的做法，判断三角头、长鼻子和乱线可能来自一段女人身体特写。图片本身仍不能说明三个结构分别对应什么，也没有提供女人身份。\n\n{{user}}打开王授军云盘里的备份视频后，确认三角头对应林茜充血的阴唇和身体轮廓，长鼻子对应被阴唇夹住、垂在阴道外的半截乳白色避孕套，乱线对应阴唇皱褶、液体痕迹和套口。\n\n视频拍到王授军戴着避孕套与林茜阴道性交。王授军射精后退出，避孕套从阴茎上脱落并夹在林茜阴唇之间。王授军取下旧套，又把同一只套重新戴回阴茎；林茜发现后叹气，随后让他继续插入。\n\n王授军的PE发送记录把《面壁者》近照列入发往林茜手机的“种子”，并把它与熊猫人动图、《剥削》局部和旧楼通话音频分批送达。\n</qrxd_reveal_wallfacer>\n"
}
