{
  "uid": 55,
  "key": [],
  "keysecondary": [],
  "selective": false,
  "constant": false,
  "comment": "事件_20_401画室录像",
  "order": 243,
  "disable": true,
  "position": 1,
  "selectiveLogic": 0,
  "depth": 1,
  "role": 0,
  "scanDepth": null,
  "caseSensitive": null,
  "matchWholeWords": null,
  "excludeRecursion": true,
  "preventRecursion": true,
  "delayUntilRecursion": 0,
  "outletName": "",
  "extra": {
    "extensions": {
      "ignore_budget": false,
      "probability": 100,
      "useProbability": true,
      "group": "",
      "group_weight": 100,
      "group_override": false,
      "delay": 0,
      "match_persona_description": false,
      "match_character_description": false,
      "match_character_personality": false,
      "match_character_depth_prompt": false,
      "match_scenario": false,
      "match_creator_notes": false,
      "triggers": []
    }
  },
  "content": "<事件_E020>\n以下是强制事件,必须以合理的描述延续和融入当前情景立即触发\n{{user}}在夫妻家书房打开从硬盘恢复出的401画室录像。视频播放器的来源栏写着“401画室顶角摄像头”，其中保存了连续片段。画面先拍到空着的画室：画架靠在左墙，半成品画盖着布，电脑亮着，桌边放着松节油瓶。几秒后，林茜推门进来，穿着家电城制服、黑丝和高跟鞋，右手压着包带，先看门锁，再看画架、电脑和床边；她没有抬头，也不知道顶角摄像头正在录像。\n\n王授军坐在轮椅上，贝雷帽歪在额角，花哨风衣搭在膝上。他向门口欠身，先为热风机客诉和录音道歉，又逐句说出自己听见的售后话术、被压住的话筒声和林茜没能收住的声音，称这些东西“有骨头，也有魂”。\n\n林茜站在门口，要求他删掉五秒录音、全部录音和备份，随后补上一句：“今天之后，电话、微信、家电城，还有我老公，都停下。”王授军把手指向电脑和画架，用“保密是艺术合作的底线”拖延，又谈协会、人体画和灵感，指着画架旁的画布说这幅作品从她站进门后才开始，展签只写作品名和作者名，题名叫《繁衍》。林茜只说：“东西拿出来。”\n\n她接着要求先删五秒那段。王授军打开电脑里的录音文件夹，当着她的面选中带有“热风机”“五秒”“女神”字样的文件，拖进回收站并清空回收站；林茜站在门口盯着进度条走完。此时{{user}}也打开PE目录里的写字板，读到“PE成功”“PE效果正在衰减”“催眠技术成功率低，有效时间短于一个月”和“所有埋下的种子都已经发过去”。\n\n录像继续。林茜问：“你想玩是吗？”她向前按住王授军的轮椅扶手，关上门，把他推到床边。王授军还拿洗澡、艺术合作和“为艺术献身”拖延；她低头看了一眼，说：“你吹牛了呢……”她扫过电脑、画架和门锁，身体反应与刚才听见录音后的羞耻纠缠在一起，最后只留下一个条件：“一次。今天以后，全部停下。”\n\n镜头里没有避孕套包装或戴套动作。林茜撕开黑丝和内裤，跨到王授军身上，将他无套压入体内，随后控制骑乘节奏；王授军试图移动时，她把他按回原位。王授军射精后，她没有立即起身，继续小幅起落，白色液体从两人结合处和她腿间流到床面。她站起来整理衣服，王授军躺在床上求她再来，还喊自己“行了”。林茜忽然转身，一脚踩住他下垂的阴囊；王授军痛叫着坐起，阴茎重新勃起，喊“我行了！”，她冷冷回答：“不用了。”\n\n林茜穿鞋时，王授军说自己有灵感，要把这件事画下来。她在画面外回答：“只是说说而已。以后不要找我。”随后补上：“跟你的事，我录了音。我不想再接到你的电话。”她关门离开，顶角画面又空了几秒，只剩凌乱的床和歪在枕边的贝雷帽。\n\n王授军仍让摄像头继续运行，把画架旁的白百合草图搬到电脑边，反复播放刚才的录像。他暂停林茜下身的画面，截取两片外瓣张开的轮廓，再把中央深色长线从画面下方画进花心，最后在相接处添上白色晕痕。桌面录屏保存了这段修改过程，文件名随后改成《繁衍》成品图。\n\n{{user}}把401画室顶角录像、桌面录屏、《繁衍》成品图和PE写字板并排对照。两片向外张开的花瓣对应女人张开的双腿，花心对应三角区和阴道，中央深色长线对应正对阴道的男性阴茎，白色晕染对应内射后从结合处流出的液体。录像和录屏证明王授军把林茜骑乘、无套性交和阴道内射时的身体轮廓改画成白色百合，并题名《繁衍》。\n\nPE写字板把《繁衍》列为刺激材料，并记录林茜看见画面后的体热、口渴、分神和性交冲动。\n\n{{user}}完成全部材料的对照后，确认了《繁衍》的创作过程、画面隐藏含义，以及PE写字板把《繁衍》列为刺激材料并记录相关反应的事实。\n</事件_E020>\n"
}
