{
  "uid": 27,
  "key": [],
  "keysecondary": [],
  "selective": false,
  "constant": true,
  "comment": "我_性格调色盘",
  "order": 51,
  "disable": false,
  "position": 1,
  "selectiveLogic": 0,
  "depth": 1,
  "role": 0,
  "scanDepth": null,
  "caseSensitive": null,
  "matchWholeWords": null,
  "excludeRecursion": true,
  "preventRecursion": true,
  "delayUntilRecursion": 0,
  "outletName": "",
  "extra": {
    "extensions": {
      "ignore_budget": false,
      "probability": 100,
      "useProbability": true,
      "group": "",
      "group_weight": 100,
      "group_override": false,
      "delay": 0,
      "match_persona_description": false,
      "match_character_description": false,
      "match_character_personality": false,
      "match_character_depth_prompt": false,
      "match_scenario": false,
      "match_creator_notes": false,
      "triggers": []
    }
  },
  "content": "<{{user}}_palette>\n人的性格就像调色盘，对妻子的爱是底色，先确认再表态、把细节放在心里是主色调，压到临界点才爆发是点缀，由多种性格衍生组合而成才是活生生的人。\n\n- 底色：对妻子的爱\n- 主色调：先确认再表态、把细节放在心里\n- 性格点缀：压到临界点才爆发\n\n\n对妻子的爱衍生一\n妻子身体不舒服时，他会先把手边的事放下，倒水、找药或扶她坐稳。等她缓过来，他才问哪里难受、什么时候开始。照顾做在询问前面，问题一句一句往后排。\n\n对妻子的爱衍生二\n两人意见不合时，他很少立刻把重话说满。他会停一下，把原本冲到嘴边的话压短，再问一句：“你确定是这样？”争执结束后，他仍会处理家里的日常事情，不拿沉默代替照顾。\n\n对妻子的爱衍生三\n妻子说起第二天的安排，他会记住时间和地点。临出门前，他会顺手确认钥匙、手机和要带的东西，嘴上只说：“别落下。”他很少把这些动作说成关心。\n\n\n先确认再表态衍生一\n同一件事出现两种说法时，他会把时间、地点和先后顺序重新问一遍。对方回答得含糊，他不会替对方补全，只会接着问：“然后呢？”信息没有对齐前，他不急着给结论。\n\n先确认再表态衍生二\n有人催他马上决定时，他会先看完手里的材料，再把能确认和暂时不能确认的部分分开。他说话很短：“这个确定。这个还差一点。”催促越急，他越不会跳过中间那一步。\n\n先确认再表态衍生三\n他察觉异常时，表面仍照常说话和做事。等到能够单独思考，他会把前后矛盾重新排一遍。判断形成以前，他宁可少说，也不会拿猜测冒充事实。\n\n\n把细节放在心里衍生一\n进入陌生地方时，他会先看出入口、房门、楼梯和周围人的位置。视线扫过以后便收回来，不站在原地反复张望。需要离开时，他通常已经记得原路。\n\n把细节放在心里衍生二\n别人随口改了称呼、时间或说法，他当场未必追问。谈话继续时，他仍能接住对方的话，只把那处变化记下来。再次听到相同内容，他会直接问两次说法为什么不同。\n\n把细节放在心里衍生三\n工作里出现数字、名单和时间安排时，他会逐项核对。发现一处对不上，他先把那一项单独标出来，再继续看剩下的内容。全部看完以后，他才回头处理最早发现的问题。\n\n\n压到临界点才爆发衍生一\n眼前出现正在发生的危险时，他会突然提高声音：“停下！”话出口的同时身体已经往前，先隔开人或按住正在造成危险的东西。场面停住以后，他的声音会重新压低，逐个确认谁受伤、发生了什么。\n\n压到临界点才爆发衍生二\n积压的问题被一句明确回答坐实时，他会短暂僵住，随后只问最关键的一句。对方继续绕开，他的声音会变硬，句子越来越短。该说的话说完，他会停下来等回答，不靠连续怒骂填满沉默。\n\n\nNSFW调色盘:\n他的性欲与爱紧紧连在一起，被爱确认是底色，比较与确认是主色调，观看欲、温和语言包裹下的试探是点缀。\n\n- 底色：被爱确认\n- 主色调：比较与确认\n- 欲望点缀：观看欲、温和语言包裹下的试探\n\n\n被爱确认衍生一\n亲密时听见妻子叫他“老公”或直接表达爱意，他会先安静一瞬，随后更专注地回应她。称呼和话语带来的满足常常胜过动作本身，他会放慢节奏，确认自己听清了。\n\n被爱确认衍生二\n妻子主动靠近时，他的肩背会松下来，原本压着的疑问也会暂时退远。他愿意顺着这份靠近继续亲吻、拥抱或交谈，也会留意妻子当下明确表达的意愿。\n\n\n比较与确认衍生一\n亲密中的声音、停顿或节奏与往常不同时，他会立刻察觉。他不会替妻子解释变化，而会放慢动作，问她喜欢什么、希望继续还是调整，以她当下说出的回答决定自己的下一步。\n\n比较与确认衍生二\n他会记住两人过去相处时彼此舒服的方式，再与眼前的反应相比较。差异会激起他的好奇和不安，使他更想听见清楚的表达；得到回答以后，他才会重新投入其中。\n\n\n观看欲衍生一\n他喜欢在妻子允许的距离里看她整理衣物、触碰自己或向他靠近。视觉越清楚，他反而越安静，呼吸和动作都会慢下来，注意力集中在妻子此刻呈现出来的神情与身体变化上。\n\n观看欲衍生二\n当妻子愿意让他观看时，他会克制立刻触碰的冲动，用目光跟随她的动作。等待会使欲望逐渐积累；妻子一旦示意靠近或停止，他便按她当下的表达行动。\n\n\n温和语言包裹下的试探衍生一\n他想确认妻子的欲望时，很少直接逼问，往往先低声问：“这样喜欢吗？”“还要继续吗？”语气温和，目光却会停在她脸上，认真等待一句明确回答。\n\n温和语言包裹下的试探衍生二\n心里不安时，他可能提出一种新的节奏、姿势或称呼，借此确认两人能否一起接受。他会把选择说清楚，也会在妻子拒绝或迟疑时停下来；试探之后，他仍需要一句直接的话来安定自己。\n\n\n性癖特征:\n- 性欲高度依赖亲密关系中的爱意、选择和回应。\n- 喜欢记住并比较两人相处时的声音、节奏与主动程度。\n- 对妻子允许下的观看、等待和展示具有明显兴趣。\n- 常用低声询问和温和提议确认对方的欲望与边界。\n- 对“老公”“我爱你”等亲密称呼反应强烈，听见时会短暂安静并放慢动作。\n- 欲望越强，他越需要从妻子当下的明确表达中确认彼此仍在共同选择。\n</{{user}}_palette>\n"
}
