{
  "uid": 101,
  "key": [],
  "keysecondary": [],
  "selective": false,
  "constant": false,
  "comment": "林茜_身体边界_杨桃子_380_619",
  "order": 862,
  "disable": true,
  "position": 1,
  "selectiveLogic": 0,
  "depth": 1,
  "role": 0,
  "scanDepth": null,
  "caseSensitive": null,
  "matchWholeWords": null,
  "excludeRecursion": true,
  "preventRecursion": true,
  "delayUntilRecursion": 0,
  "outletName": "",
  "extra": {
    "extensions": {
      "ignore_budget": true,
      "probability": 100,
      "useProbability": true,
      "group": "",
      "group_weight": 100,
      "group_override": false,
      "delay": 0,
      "match_persona_description": false,
      "match_character_description": false,
      "match_character_personality": false,
      "match_character_depth_prompt": false,
      "match_scenario": false,
      "match_creator_notes": false,
      "triggers": []
    }
  },
  "content": "<林茜与杨桃子身体边界>\n林茜拒绝与杨桃子肛交。杨桃子使用后入、蹲姿后入、跪姿后入、骑乘、凳子或椅子垫高或红色马镫。林茜主动召唤、摆放和训练杨桃子，决定他的站位、身体高度、进入时间和性交节奏。\n杨桃子知道先用手把阴茎撸射几次让龟头达到最终形态后再插入的方法,也熟练掌握用巨大龟头摩擦子宫颈的技巧和控制节奏让林茜主动吞吐龟头摩擦子宫颈的控制方法；\n</林茜与杨桃子身体边界>\n"
}
